{
  "schemaVersion": 3,
  "defaultLanguage": "EN",
  "languages": ["EN", "ZH_CN"],
  "contexts": {
    "alone": ["coffee", "lunch", "walk", "gym", "running", "cycling", "cinema", "museum", "volunteering", "workshop", "board_games", "shopping", "wellness", "sightseeing", "reading", "learning", "beach_day", "swimming", "paddleboarding", "stargazing", "nature_photography", "movie_night", "home_workout", "video_games", "grocery_shopping", "fashion_shopping", "electronics_shopping", "book_shopping", "home_decor_shopping", "antique_shopping"],
    "social_group": ["coffee", "lunch", "dinner", "drinks", "walk", "hike", "gym", "running", "cycling", "cinema", "museum", "concert", "volunteering", "workshop", "brunch", "food_tour", "picnic", "parade", "pub_quiz", "nightlife", "board_games", "meetup", "climbing", "bowling", "sports", "wellness", "theatre", "sightseeing", "learning", "beach_day", "swimming", "surfing", "paddleboarding", "camping", "stargazing", "team_building", "networking_event", "coworking_session", "offsite_workshop", "office_party", "lunch_and_learn", "karaoke", "video_games", "grocery_shopping", "fashion_shopping", "electronics_shopping", "book_shopping", "toy_shopping", "home_decor_shopping", "antique_shopping", "soft_play", "mini_golf", "amusement_park", "science_centre"],
    "friends": ["coffee", "lunch", "dinner", "drinks", "walk", "hike", "gym", "running", "cycling", "cinema", "museum", "concert", "volunteering", "workshop", "brunch", "food_tour", "picnic", "parade", "pub_quiz", "nightlife", "board_games", "meetup", "shopping", "climbing", "bowling", "sports", "wellness", "theatre", "sightseeing", "reading", "learning", "beach_day", "swimming", "surfing", "paddleboarding", "camping", "stargazing", "birdwatching", "forest_walk", "mountain_hike", "lake_picnic", "nature_photography", "movie_night", "cooking_together", "karaoke", "video_games", "home_workout", "wine_tasting", "team_building", "networking_event", "business_lunch", "after_work_drinks", "coworking_session", "offsite_workshop", "office_party", "lunch_and_learn", "grocery_shopping", "fashion_shopping", "electronics_shopping", "book_shopping", "toy_shopping", "home_decor_shopping", "antique_shopping", "mini_golf", "amusement_park", "science_centre", "playground_day", "soft_play", "childrens_museum", "zoo_visit", "aquarium_visit", "story_time"],
    "family": ["lunch", "dinner", "walk", "hike", "cinema", "museum", "concert", "volunteering", "workshop", "brunch", "food_tour", "picnic", "parade", "board_games", "shopping", "bowling", "sports", "theatre", "sightseeing", "beach_day", "swimming", "paddleboarding", "camping", "stargazing", "birdwatching", "forest_walk", "lake_picnic", "nature_photography", "movie_night", "cooking_together", "karaoke", "video_games", "home_workout", "grocery_shopping", "book_shopping", "toy_shopping", "home_decor_shopping", "playground_day", "soft_play", "mini_golf", "childrens_museum", "zoo_visit", "aquarium_visit", "amusement_park", "science_centre", "story_time"],
    "romantic": ["coffee", "lunch", "dinner", "drinks", "walk", "cinema", "museum", "concert", "getting_intimate", "dating", "brunch", "food_tour", "picnic", "parade", "pub_quiz", "nightlife", "shopping", "theatre", "sightseeing", "beach_day", "swimming", "stargazing", "camping", "movie_night", "cooking_together", "wine_tasting", "after_work_drinks", "fashion_shopping", "antique_shopping", "home_decor_shopping"],
    "adultOnly": ["drinks", "nightlife", "getting_intimate", "dating", "pub_quiz", "wine_tasting", "after_work_drinks"],
    "parentChild": ["beach_day", "swimming", "picnic", "walk", "museum", "cinema", "board_games", "video_games", "cooking_together", "karaoke", "movie_night", "bowling", "camping", "stargazing", "birdwatching", "forest_walk", "lake_picnic", "nature_photography", "grocery_shopping", "book_shopping", "toy_shopping", "playground_day", "soft_play", "mini_golf", "childrens_museum", "zoo_visit", "aquarium_visit", "amusement_park", "science_centre", "story_time"],
    "travel": ["coffee", "brunch", "lunch", "food_tour", "sightseeing", "museum", "learning", "walk", "hike", "mountain_hike", "forest_walk", "lake_picnic", "picnic", "camping", "stargazing", "nature_photography", "birdwatching", "beach_day", "swimming", "surfing", "paddleboarding", "shopping", "book_shopping", "wellness", "workshop", "zoo_visit", "aquarium_visit", "amusement_park", "science_centre"]
  },
  "locationCategories": [
    {"id": "cafe", "isPublicVenue": true, "sourceTags": ["cafe", "cafeteria"], "activityIds": ["coffee", "brunch", "lunch", "reading", "workshop", "meetup", "learning"]},
    {"id": "restaurant", "isPublicVenue": true, "sourceTags": ["restaurant"], "activityIds": ["brunch", "lunch", "dinner"]},
    {"id": "bar", "isPublicVenue": true, "sourceTags": ["bar", "gay_bar"], "activityIds": ["drinks", "pub_quiz", "nightlife"]},
    {"id": "pub", "isPublicVenue": true, "sourceTags": ["pub"], "activityIds": ["drinks", "pub_quiz", "lunch", "dinner"]},
    {"id": "nightclub", "isPublicVenue": true, "sourceTags": ["nightclub"], "activityIds": ["nightlife", "drinks", "concert"]},
    {"id": "park", "isPublicVenue": true, "sourceTags": ["park", "garden"], "activityIds": ["walk", "hike", "picnic", "parade", "running", "sports", "volunteering", "sightseeing", "wellness"]},
    {"id": "arts_centre", "isPublicVenue": true, "sourceTags": ["arts_centre"], "activityIds": ["workshop", "theatre", "concert", "museum", "sightseeing"]},
    {"id": "cinema", "isPublicVenue": true, "sourceTags": ["cinema"], "activityIds": ["cinema"]},
    {"id": "theatre", "isPublicVenue": true, "sourceTags": ["theatre"], "activityIds": ["theatre", "concert"]},
    {"id": "concert_hall", "isPublicVenue": true, "sourceTags": ["concert_hall", "music_venue"], "activityIds": ["concert", "theatre"]},
    {"id": "museum", "isPublicVenue": true, "sourceTags": ["museum"], "activityIds": ["museum", "learning", "workshop", "sightseeing"]},
    {"id": "gallery", "isPublicVenue": true, "sourceTags": ["gallery", "art_gallery"], "activityIds": ["museum", "workshop", "sightseeing"]},
    {"id": "attraction", "isPublicVenue": true, "sourceTags": ["attraction", "tourist_attraction", "aquarium", "zoo", "viewpoint"], "activityIds": ["sightseeing", "walk", "picnic", "learning", "food_tour"]},
    {"id": "sports_centre", "isPublicVenue": true, "sourceTags": ["sports_centre", "sports", "fitness_centre", "stadium"], "activityIds": ["sports", "gym", "running", "cycling", "bowling"]},
    {"id": "climbing_gym", "isPublicVenue": true, "sourceTags": ["climbing_gym"], "activityIds": ["climbing"]},
    {"id": "bowling_alley", "isPublicVenue": true, "sourceTags": ["bowling_alley"], "activityIds": ["bowling", "board_games", "sports"]},
    {"id": "games_hall", "isPublicVenue": true, "sourceTags": ["games_hall", "amusement_arcade"], "activityIds": ["board_games", "pub_quiz", "bowling"]},
    {"id": "library", "isPublicVenue": true, "sourceTags": ["library"], "activityIds": ["reading", "learning", "workshop"]},
    {"id": "community_centre", "isPublicVenue": true, "sourceTags": ["community_centre"], "activityIds": ["meetup", "workshop", "volunteering", "learning"]},
    {"id": "market", "isPublicVenue": true, "sourceTags": ["marketplace", "market"], "activityIds": ["shopping", "food_tour", "coffee", "lunch", "sightseeing"]},
    {"id": "shopping_centre", "isPublicVenue": true, "sourceTags": ["shopping_mall"], "activityIds": ["shopping", "coffee", "food_tour", "sightseeing"]},
    {"id": "home", "isPublicVenue": false, "sourceTags": ["home"], "activityIds": ["coffee", "brunch", "lunch", "dinner", "board_games", "reading", "learning", "workshop", "wellness", "getting_intimate", "dating", "movie_night", "cooking_together", "karaoke", "video_games", "home_workout", "wine_tasting", "playground_day", "story_time", "soft_play", "mini_golf", "childrens_museum", "zoo_visit", "aquarium_visit", "amusement_park", "science_centre"]},
    {"id": "workplace", "isPublicVenue": false, "sourceTags": ["office", "workplace"], "activityIds": ["coffee", "lunch", "meetup", "workshop", "learning", "sports", "wellness", "board_games", "pub_quiz", "team_building", "networking_event", "business_lunch", "after_work_drinks", "coworking_session", "offsite_workshop", "office_party", "lunch_and_learn"]},
    {"id": "institution", "isPublicVenue": false, "sourceTags": ["school", "university", "college", "place_of_worship", "hospital"], "activityIds": ["learning", "reading", "workshop", "meetup", "volunteering", "sightseeing", "museum", "concert", "theatre"]},
    {"id": "beach", "isPublicVenue": true, "sourceTags": ["beach"], "activityIds": ["beach_day", "swimming", "surfing", "paddleboarding", "picnic", "walk", "stargazing", "sightseeing"]},
    {"id": "forest", "isPublicVenue": true, "sourceTags": ["forest", "wood"], "activityIds": ["forest_walk", "hike", "picnic", "camping", "birdwatching", "nature_photography", "stargazing"]},
    {"id": "lake", "isPublicVenue": true, "sourceTags": ["lake", "reservoir"], "activityIds": ["lake_picnic", "swimming", "paddleboarding", "walk", "camping", "stargazing", "nature_photography"]},
    {"id": "mountain", "isPublicVenue": true, "sourceTags": ["mountain", "peak"], "activityIds": ["mountain_hike", "hike", "camping", "stargazing", "nature_photography", "birdwatching"]},
    {"id": "nature_reserve", "isPublicVenue": true, "sourceTags": ["nature_reserve", "national_park"], "activityIds": ["birdwatching", "nature_photography", "forest_walk", "hike", "camping", "stargazing", "volunteering"]},
    {"id": "river", "isPublicVenue": true, "sourceTags": ["river", "riverside"], "activityIds": ["walk", "picnic", "swimming", "paddleboarding", "birdwatching", "nature_photography"]},
    {"id": "botanical_garden", "isPublicVenue": true, "sourceTags": ["botanical_garden"], "activityIds": ["walk", "picnic", "nature_photography", "birdwatching", "sightseeing"]},